topic,query,title,url,timestamp,search_depth
vaccine hesitancy,site:reddit.com religious view on vaccination myths,Religious vaccination exemption ends for health care workers in NY.,https://www.reddit.com/r/atheism/comments/r0jmde/religious_vaccination_exemption_ends_for_health/,2024-11-30T16:36:22.950225,advanced
vaccine hesitancy,site:reddit.com religious view on vaccination myths,Religious Exemption for Vaccine Opt Out.... : r/nursing - Reddit,https://www.reddit.com/r/nursing/comments/qz3py6/religious_exemption_for_vaccine_opt_out/,2024-11-30T16:36:22.977025,advanced
vaccine hesitancy,site:reddit.com religious view on vaccination myths,CMV: there shouldn't be religious exemptions for vaccine mandates,https://www.reddit.com/r/changemyview/comments/rlc64c/cmv_there_shouldnt_be_religious_exemptions_for/,2024-11-30T16:36:22.991029,advanced
vaccine hesitancy,site:reddit.com religious view on vaccination myths,I-693 Medical form and exemption based on religious and moral ... - Reddit,https://www.reddit.com/r/USCIS/comments/u2171c/i693_medical_form_and_exemption_based_on/,2024-11-30T16:36:23.007858,advanced
vaccine hesitancy,site:reddit.com religious view on vaccination myths,Myths about Christian history that are popular but misleading,https://www.reddit.com/r/religion/comments/mxgfg3/myths_about_christian_history_that_are_popular/,2024-11-30T16:36:23.026263,advanced
vaccine hesitancy,site:reddit.com religious view on vaccination myths,Why are religious exemptions for vaccines a thing?,https://www.reddit.com/r/NoStupidQuestions/comments/1b1h5s8/why_are_religious_exemptions_for_vaccines_a_thing/,2024-11-30T16:36:23.045935,advanced
vaccine hesitancy,site:reddit.com religious view on vaccination myths,"CMV: there's no such thing as a ""religious exemption"" from vaccines",https://www.reddit.com/r/changemyview/comments/psk8ol/cmv_theres_no_such_thing_as_a_religious_exemption/,2024-11-30T16:36:23.060207,advanced
vaccine hesitancy,site:reddit.com religious view on vaccination myths,A majority of Americans are critical of religious exemptions ... - Reddit,https://www.reddit.com/r/Coronavirus/comments/rd7vxj/a_majority_of_americans_are_critical_of_religious/,2024-11-30T16:36:23.074218,advanced
vaccine hesitancy,site:reddit.com religious view on vaccination myths,Getting fired for not getting vaccine. Denied my religious ... - Reddit,https://www.reddit.com/r/legaladvice/comments/q0taew/getting_fired_for_not_getting_vaccine_denied_my/,2024-11-30T16:36:23.179322,advanced
vaccine hesitancy,site:reddit.com religious view on vaccination myths,Can Someone Explain the Religious Argument Against Vaccination?,https://www.reddit.com/r/atheism/comments/1529v8r/can_someone_explain_the_religious_argument/,2024-11-30T16:36:23.198805,advanced
vaccine hesitancy,site:reddit.com religious view on vaccination myths,A Guide to Vaccine Exemptions Revised : r/TraditionalCatholics - Reddit,https://www.reddit.com/r/TraditionalCatholics/comments/qtg2oj/a_guide_to_vaccine_exemptions_revised/,2024-11-30T16:36:23.215130,advanced
vaccine hesitancy,site:reddit.com religious view on vaccination myths,CMV: The Jesus Myth Hypothesis is Plausible : r/changemyview - Reddit,https://www.reddit.com/r/changemyview/comments/37h2pb/cmv_the_jesus_myth_hypothesis_is_plausible/,2024-11-30T16:36:23.231570,advanced
vaccine hesitancy,site:reddit.com religious view on vaccination myths,Covid vaccination exemption : r/notredame - Reddit,https://www.reddit.com/r/notredame/comments/o8d1lh/covid_vaccination_exemption/,2024-11-30T16:36:23.247661,advanced
vaccine hesitancy,site:reddit.com religious view on vaccination myths,Can we talk about religious exemptions from the Vaccine in ... - Reddit,https://www.reddit.com/r/CoronavirusWA/comments/p750io/can_we_talk_about_religious_exemptions_from_the/,2024-11-30T16:36:23.262621,advanced
vaccine hesitancy,site:reddit.com religious view on vaccination myths,What Is The Difference Between Religion And Mythology?,https://www.reddit.com/r/religion/comments/ye3ucd/what_is_the_difference_between_religion_and/,2024-11-30T16:36:23.276115,advanced
vaccine hesitancy,site:reddit.com religious view on vaccination myths,Hochul says religious exemption not a legitimate excuse to ... - Reddit,https://www.reddit.com/r/Coronavirus/comments/ppbf90/hochul_says_religious_exemption_not_a_legitimate/,2024-11-30T16:36:23.376632,advanced
vaccine hesitancy,site:reddit.com religious view on vaccination myths,Sky Woman: A Creation Myth Aligns More Closely with Modern ... - Reddit,https://www.reddit.com/r/DebateReligion/comments/167bfns/sky_woman_a_creation_myth_aligns_more_closely/,2024-11-30T16:36:23.393718,advanced
vaccine hesitancy,site:reddit.com religious view on vaccination myths,Covid Vaccine Religious Exemption : r/Catholicism - Reddit,https://www.reddit.com/r/Catholicism/comments/mi8ngy/covid_vaccine_religious_exemption/,2024-11-30T16:36:23.411152,advanced
vaccine hesitancy,site:reddit.com religious view on vaccination myths,Did the ancient Greeks/Romans believe their myths were ... - Reddit,https://www.reddit.com/r/AskHistorians/comments/41bmwr/did_the_ancient_greeksromans_believe_their_myths/,2024-11-30T16:36:23.428542,advanced
vaccine hesitancy,site:reddit.com religious view on vaccination myths,r/religion on Reddit: Unraveling the Truth: Debunking Myths and ...,https://www.reddit.com/r/religion/comments/11qz055/unraveling_the_truth_debunking_myths_and/,2024-11-30T16:36:23.453313,advanced
