topic,query,title,url,timestamp,search_depth
vaccine programs,site:reddit.com rural communities view on vaccine programs,If anyone wonders how people in rural communities become ... - Reddit,https://www.reddit.com/r/vaxxhappened/comments/pemitl/if_anyone_wonders_how_people_in_rural_communities/,2024-11-30T17:10:37.580383,advanced
vaccine programs,site:reddit.com rural communities view on vaccine programs,My chances at v-tech engineering : r/chanceme - Reddit,https://www.reddit.com/r/chanceme/comments/j2svxi/my_chances_at_vtech_engineering/,2024-11-30T17:10:37.597524,advanced
vaccine programs,site:reddit.com rural communities view on vaccine programs,Pacific University Oregon - Reddit,https://www.reddit.com/r/PacificU/,2024-11-30T17:10:37.611452,advanced
vaccine programs,site:reddit.com rural communities view on vaccine programs,Tip 12: ERAS Application 2024 - Geographical Preferences,https://www.reddit.com/r/medicalschool/comments/136uyde/tip_12_eras_application_2024_geographical/,2024-11-30T17:10:37.626337,advanced
vaccine programs,site:reddit.com rural communities view on vaccine programs,CDC study finds disparities in Covid vaccine rates between rural and ...,https://www.reddit.com/r/CoronavirusUS/comments/nffh3i/cdc_study_finds_disparities_in_covid_vaccine/,2024-11-30T17:10:37.640820,advanced
vaccine programs,site:reddit.com rural communities view on vaccine programs,Rural areas are getting a different vaccine to the cities,https://www.reddit.com/r/DebateVaccines/comments/k1kops/rural_areas_are_getting_a_different_vaccine_to/,2024-11-30T17:10:37.653470,advanced
vaccine programs,site:reddit.com rural communities view on vaccine programs,What are rural jobs that pay well? : r/findapath - Reddit,https://www.reddit.com/r/findapath/comments/14os8p0/what_are_rural_jobs_that_pay_well/,2024-11-30T17:10:37.668594,advanced
vaccine programs,site:reddit.com rural communities view on vaccine programs,Health minister says Ontario has no immediate plans to follow Alberta ...,https://www.reddit.com/r/CanadaCoronavirus/comments/sotxfx/health_minister_says_ontario_has_no_immediate/,2024-11-30T17:10:37.684370,advanced
vaccine programs,site:reddit.com rural communities view on vaccine programs,People in rural areas: how do you actually meet people (irl)?? - Reddit,https://www.reddit.com/r/DatingAfterThirty/comments/a0rtbf/people_in_rural_areas_how_do_you_actually_meet/,2024-11-30T17:10:37.725373,advanced
vaccine programs,site:reddit.com rural communities view on vaccine programs,What's it like living in rural areas of the country?,https://www.reddit.com/r/AskAnAmerican/comments/dc53z7/whats_it_like_living_in_rural_areas_of_the_country/,2024-11-30T17:10:37.744844,advanced
vaccine programs,site:reddit.com rural communities view on vaccine programs,COVID-19 vaccine coverage disparities in rural and farm children,https://www.reddit.com/r/COVID19/comments/10bnfty/covid19_vaccine_coverage_disparities_in_rural_and/,2024-11-30T17:10:37.758911,advanced
vaccine programs,site:reddit.com rural communities view on vaccine programs,"Faith, Freedom, Fear: Rural America's Covid Vaccine Skeptics",https://www.reddit.com/r/Coronavirus/comments/n25d68/faith_freedom_fear_rural_americas_covid_vaccine/,2024-11-30T17:10:37.772603,advanced
vaccine programs,site:reddit.com rural communities view on vaccine programs,CDC study finds disparities in Covid vaccine rates between rural and ...,https://www.reddit.com/r/Coronavirus/comments/nffiu4/cdc_study_finds_disparities_in_covid_vaccine/,2024-11-30T17:10:37.786409,advanced
vaccine programs,site:reddit.com rural communities view on vaccine programs,"Open spaces, no pharmacies: rural US confronts vaccine void",https://www.reddit.com/r/Coronavirus/comments/lz4pib/open_spaces_no_pharmacies_rural_us_confronts/,2024-11-30T17:10:37.799961,advanced
vaccine programs,site:reddit.com rural communities view on vaccine programs,Nursing school without the COVID vaccine : r/nursing - Reddit,https://www.reddit.com/r/nursing/comments/160lcvi/nursing_school_without_the_covid_vaccine/,2024-11-30T17:10:37.814868,advanced
vaccine programs,site:reddit.com rural communities view on vaccine programs,"[US]: Study Finds COVID-19 Vaccines Lag In Rural, Underdeveloped Areas",https://www.reddit.com/r/CoronavirusUS/comments/zo0os3/us_study_finds_covid19_vaccines_lag_in_rural/,2024-11-30T17:10:37.828032,advanced
vaccine programs,site:reddit.com rural communities view on vaccine programs,Practicing in rural area after residency in academic urban ... - Reddit,https://www.reddit.com/r/FamilyMedicine/comments/16h38c9/practicing_in_rural_area_after_residency_in/,2024-11-30T17:10:37.842544,advanced
vaccine programs,site:reddit.com rural communities view on vaccine programs,Any Kaiser patients turned away from Walgreens/CVS for COVID ... - Reddit,https://www.reddit.com/r/bayarea/comments/16o698x/any_kaiser_patients_turned_away_from_walgreenscvs/,2024-11-30T17:10:37.858268,advanced
vaccine programs,site:reddit.com rural communities view on vaccine programs,[OC] Life expectancy vs. health expenditure : r/dataisbeautiful - Reddit,https://www.reddit.com/r/dataisbeautiful/comments/1cu0qsg/oc_life_expectancy_vs_health_expenditure/,2024-11-30T17:10:37.872543,advanced
vaccine programs,site:reddit.com rural communities view on vaccine programs,New vaccine campaigns target rural Americans to address disparities,https://www.reddit.com/r/Coronavirus/comments/qq4tlb/new_vaccine_campaigns_target_rural_americans_to/,2024-11-30T17:10:37.885540,advanced
