topic,query,title,url,timestamp,search_depth
vaccine programs,site:reddit.com rural communities and vaccine programs,Rural hospitals can't afford freezers to store a Covid-19 vaccine,https://www.reddit.com/r/politics/comments/jsgmzm/rural_hospitals_cant_afford_freezers_to_store_a/,2024-11-30T17:10:29.791561,advanced
vaccine programs,site:reddit.com rural communities and vaccine programs,MU project awarded $2 million grant to improve child and teen vaccine ...,https://www.reddit.com/r/missouri/comments/1cux564/mu_project_awarded_2_million_grant_to_improve/,2024-11-30T17:10:29.807831,advanced
vaccine programs,site:reddit.com rural communities and vaccine programs,"Open spaces, no pharmacies: rural US confronts vaccine void",https://www.reddit.com/r/Coronavirus/comments/lz4pib/open_spaces_no_pharmacies_rural_us_confronts/,2024-11-30T17:10:29.820689,advanced
vaccine programs,site:reddit.com rural communities and vaccine programs,New vaccine campaigns target rural Americans to address disparities,https://www.reddit.com/r/Coronavirus/comments/qq4tlb/new_vaccine_campaigns_target_rural_americans_to/,2024-11-30T17:10:29.835385,advanced
vaccine programs,site:reddit.com rural communities and vaccine programs,Rural Areas are Getting a Different Vaccine than the Cities ... - Reddit,https://www.reddit.com/r/conspiracy/comments/k1eb5e/rural_areas_are_getting_a_different_vaccine_than/,2024-11-30T17:10:29.849583,advanced
vaccine programs,site:reddit.com rural communities and vaccine programs,Why Lagging COVID Vaccine Rates Among Rural Hospitals 'Needs ... - Reddit,https://www.reddit.com/r/Coronavirus/comments/n4juew/why_lagging_covid_vaccine_rates_among_rural/,2024-11-30T17:10:29.863258,advanced
vaccine programs,site:reddit.com rural communities and vaccine programs,Gap in COVID-19 vaccine uptake between urban and rural areas ... - Reddit,https://www.reddit.com/r/Covid2019/comments/ts0r7r/gap_in_covid19_vaccine_uptake_between_urban_and/,2024-11-30T17:10:29.877975,advanced
vaccine programs,site:reddit.com rural communities and vaccine programs,Rural areas face challenges in COVID vaccine rollout,https://www.reddit.com/r/Coronavirus/comments/lhu0jn/rural_areas_face_challenges_in_covid_vaccine/,2024-11-30T17:10:29.891732,advanced
vaccine programs,site:reddit.com rural communities and vaccine programs,CDC study finds disparities in Covid vaccine rates between rural and ...,https://www.reddit.com/r/CoronavirusUS/comments/nffh3i/cdc_study_finds_disparities_in_covid_vaccine/,2024-11-30T17:10:29.905081,advanced
vaccine programs,site:reddit.com rural communities and vaccine programs,Early Access to COVID-19 Vaccine for Rural and Remote First ... - Reddit,https://www.reddit.com/r/Coronavirus/comments/kj2nyp/early_access_to_covid19_vaccine_for_rural_and/,2024-11-30T17:10:29.917889,advanced
vaccine programs,site:reddit.com rural communities and vaccine programs,What's it like living in rural areas of the country?,https://www.reddit.com/r/AskAnAmerican/comments/dc53z7/whats_it_like_living_in_rural_areas_of_the_country/,2024-11-30T17:10:29.930858,advanced
vaccine programs,site:reddit.com rural communities and vaccine programs,Urban vs rural residency : r/FamilyMedicine - Reddit,https://www.reddit.com/r/FamilyMedicine/comments/10orl0s/urban_vs_rural_residency/,2024-11-30T17:10:29.944917,advanced
vaccine programs,site:reddit.com rural communities and vaccine programs,"Why, specifically, do rural Americans feel like they're looked ... - Reddit",https://www.reddit.com/r/SeriousConversation/comments/16tinnk/why_specifically_do_rural_americans_feel_like/,2024-11-30T17:10:29.958343,advanced
vaccine programs,site:reddit.com rural communities and vaccine programs,[US] WHY can I not get vaccines at a pharmacy? : r/HealthInsurance - Reddit,https://www.reddit.com/r/HealthInsurance/comments/193h2xx/us_why_can_i_not_get_vaccines_at_a_pharmacy/,2024-11-30T17:10:29.971148,advanced
vaccine programs,site:reddit.com rural communities and vaccine programs,Any cons of living in the Japanese countryside? : r/movingtojapan - Reddit,https://www.reddit.com/r/movingtojapan/comments/qx01v9/any_cons_of_living_in_the_japanese_countryside/,2024-11-30T17:10:29.985296,advanced
vaccine programs,site:reddit.com rural communities and vaccine programs,Rural Catholic Communities? : r/Catholicism - Reddit,https://www.reddit.com/r/Catholicism/comments/12xeoo4/rural_catholic_communities/,2024-11-30T17:10:29.999037,advanced
vaccine programs,site:reddit.com rural communities and vaccine programs,"A little something I put together; my take on the ""Greater ... - Reddit",https://www.reddit.com/r/MapPorn/comments/1d4y9ib/a_little_something_i_put_together_my_take_on_the/,2024-11-30T17:10:30.012276,advanced
vaccine programs,site:reddit.com rural communities and vaccine programs,How can I STOP Amazon from using USPS? : r/amazonprime - Reddit,https://www.reddit.com/r/amazonprime/comments/12qlhol/how_can_i_stop_amazon_from_using_usps/,2024-11-30T17:10:30.025927,advanced
vaccine programs,site:reddit.com rural communities and vaccine programs,The Price of Prevention: Vaccine Costs Are Soaring : r/news - Reddit,https://www.reddit.com/r/news/comments/29qfnk/the_price_of_prevention_vaccine_costs_are_soaring/,2024-11-30T17:10:30.039524,advanced
vaccine programs,site:reddit.com rural communities and vaccine programs,Environmental Warrior: RFK Jr.'s Decades-Long Crusade for ... - Reddit,https://www.reddit.com/r/RFKJrForPresident/comments/1afevc6/environmental_warrior_rfk_jrs_decadeslong_crusade/,2024-11-30T17:10:30.052415,advanced
