topic,query,title,url,timestamp,search_depth
anti-vax,site:reddit.com trust and public perception of vaccines,Ample evidence shows that people tend to trust vaccines if ... - Reddit,https://www.reddit.com/r/science/comments/nic9l3/ample_evidence_shows_that_people_tend_to_trust/,2024-11-30T16:23:06.060760,advanced
anti-vax,site:reddit.com trust and public perception of vaccines,Trust in COVID vaccines is growing : r/science - Reddit,https://www.reddit.com/r/science/comments/lhtxyy/trust_in_covid_vaccines_is_growing/,2024-11-30T16:23:06.075941,advanced
anti-vax,site:reddit.com trust and public perception of vaccines,"Why do so many people refuse to get vaccinated? Fear, stronger than ...",https://www.reddit.com/r/Coronavirus/comments/okjlnk/why_do_so_many_people_refuse_to_get_vaccinated/,2024-11-30T16:23:06.090901,advanced
anti-vax,site:reddit.com trust and public perception of vaccines,"Vaccine hesitancy, the reluctance or refusal to receive ... - Reddit",https://www.reddit.com/r/science/comments/eeud3d/vaccine_hesitancy_the_reluctance_or_refusal_to/,2024-11-30T16:23:06.106009,advanced
anti-vax,site:reddit.com trust and public perception of vaccines,I don't trust the Vaccine : r/offmychest - Reddit,https://www.reddit.com/r/offmychest/comments/o0f61m/i_dont_trust_the_vaccine/,2024-11-30T16:23:06.119279,advanced
anti-vax,site:reddit.com trust and public perception of vaccines,If you don't trust the vaccine approved by our doctors and ... - Reddit,https://www.reddit.com/r/alberta/comments/pis90p/if_you_dont_trust_the_vaccine_approved_by_our/,2024-11-30T16:23:06.132649,advanced
anti-vax,site:reddit.com trust and public perception of vaccines,CMV: I am Afraid to take the Covid Vaccine due to Distrust of ... - Reddit,https://www.reddit.com/r/changemyview/comments/p04fzy/cmv_i_am_afraid_to_take_the_covid_vaccine_due_to/,2024-11-30T16:23:06.145686,advanced
anti-vax,site:reddit.com trust and public perception of vaccines,How much/well do you TRUST your government to give you the ... - Reddit,https://www.reddit.com/r/DebateVaccines/comments/17gpm4h/how_muchwell_do_you_trust_your_government_to_give/,2024-11-30T16:23:06.161063,advanced
anti-vax,site:reddit.com trust and public perception of vaccines,How/why did vaccines become political? : r/medicine - Reddit,https://www.reddit.com/r/medicine/comments/17qbg4h/howwhy_did_vaccines_become_political/,2024-11-30T16:23:06.176113,advanced
anti-vax,site:reddit.com trust and public perception of vaccines,I genuinely don't trust Covid vaccines : r/TrueOffMyChest - Reddit,https://www.reddit.com/r/TrueOffMyChest/comments/lxa8mi/i_genuinely_dont_trust_covid_vaccines/,2024-11-30T16:23:06.191771,advanced
anti-vax,site:reddit.com trust and public perception of vaccines,'Nudge' control during Covid - Policy of manipulation - Reddit,https://www.reddit.com/r/LockdownSkepticismAU/comments/xv95eg/nudge_control_during_covid_policy_of_manipulation/,2024-11-30T16:23:06.206213,advanced
anti-vax,site:reddit.com trust and public perception of vaccines,YLE: Why did we lose trust during the pandemic? : r/publichealth - Reddit,https://www.reddit.com/r/publichealth/comments/1bekid6/yle_why_did_we_lose_trust_during_the_pandemic/,2024-11-30T16:23:06.220258,advanced
anti-vax,site:reddit.com trust and public perception of vaccines,CMV: There is no motive for vaccine mandates in the US beyond public ...,https://www.reddit.com/r/changemyview/comments/rqlt6i/cmv_there_is_no_motive_for_vaccine_mandates_in/,2024-11-30T16:23:06.310605,advanced
anti-vax,site:reddit.com trust and public perception of vaccines,Why are people against vaccines and vaccinations?,https://www.reddit.com/r/TooAfraidToAsk/comments/y897fg/why_are_people_against_vaccines_and_vaccinations/,2024-11-30T16:23:06.326151,advanced
anti-vax,site:reddit.com trust and public perception of vaccines,How the hell does the public trust system work? : r/hoi4 - Reddit,https://www.reddit.com/r/hoi4/comments/176yna9/how_the_hell_does_the_public_trust_system_work/,2024-11-30T16:23:06.340710,advanced
anti-vax,site:reddit.com trust and public perception of vaccines,"Worrying Signs' of Falling Trust in Coronavirus Vaccines, as ... - Reddit",https://www.reddit.com/r/worldnews/comments/iohg8d/worrying_signs_of_falling_trust_in_coronavirus/,2024-11-30T16:23:06.354061,advanced
anti-vax,site:reddit.com trust and public perception of vaccines,CMV: COVID vaccines should be met with scrutiny : r/changemyview - Reddit,https://www.reddit.com/r/changemyview/comments/16rbrk6/cmv_covid_vaccines_should_be_met_with_scrutiny/,2024-11-30T16:23:06.367743,advanced
anti-vax,site:reddit.com trust and public perception of vaccines,"r/science on Reddit: Tetanus, diphtheria, and pertussis (TDaP ...",https://www.reddit.com/r/science/comments/4f3unp/tetanus_diphtheria_and_pertussis_tdap_vaccination/,2024-11-30T16:23:06.380882,advanced
anti-vax,site:reddit.com trust and public perception of vaccines,"Do you trust the CDC, FDA, and Big Pharma collectively as a ... - Reddit",https://www.reddit.com/r/DebateVaccines/comments/uje7k0/do_you_trust_the_cdc_fda_and_big_pharma/,2024-11-30T16:23:06.397722,advanced
anti-vax,site:reddit.com trust and public perception of vaccines,Yet people still trust and believe these big pharma companies,https://www.reddit.com/r/DebateVaccines/comments/rci2q5/yet_people_still_trust_and_believe_these_big/,2024-11-30T16:23:06.414912,advanced
