topic,query,title,url,timestamp,search_depth
microchips in vaccines,site:reddit.com ethnic minorities view on vaccination misinformation,COVID-19 Anti-Vaccination Misinformation Campaign Targeting POC,https://www.reddit.com/r/publichealth/comments/ozewmc/covid19_antivaccination_misinformation_campaign/,2024-11-30T16:33:14.414786,advanced
microchips in vaccines,site:reddit.com ethnic minorities view on vaccination misinformation,Sam Seder of the Majority Report explains his view on Joe ... - Reddit,https://www.reddit.com/r/JoeRogan/comments/si0slx/sam_seder_of_the_majority_report_explains_his/,2024-11-30T16:33:14.430157,advanced
microchips in vaccines,site:reddit.com ethnic minorities view on vaccination misinformation,Misinformation about the Chinese vaccines : r/asianamerican - Reddit,https://www.reddit.com/r/asianamerican/comments/zxt2m5/misinformation_about_the_chinese_vaccines/,2024-11-30T16:33:14.444728,advanced
microchips in vaccines,site:reddit.com ethnic minorities view on vaccination misinformation,NBC news story that clearly shows the media is manufacturing vaccine ...,https://www.reddit.com/r/stupidpol/comments/m3eaz9/nbc_news_story_that_clearly_shows_the_media_is/,2024-11-30T16:33:14.458532,advanced
microchips in vaccines,site:reddit.com ethnic minorities view on vaccination misinformation,"Covid vaccine: 72% of black people unlikely to have jab, UK ... - Reddit",https://www.reddit.com/r/worldnews/comments/kygdbx/covid_vaccine_72_of_black_people_unlikely_to_have/,2024-11-30T16:33:14.471041,advanced
microchips in vaccines,site:reddit.com ethnic minorities view on vaccination misinformation,CMV: COVID vaccines should be met with scrutiny : r/changemyview - Reddit,https://www.reddit.com/r/changemyview/comments/16rbrk6/cmv_covid_vaccines_should_be_met_with_scrutiny/,2024-11-30T16:33:14.485297,advanced
microchips in vaccines,site:reddit.com ethnic minorities view on vaccination misinformation,Study links Covid-19 vaccination hesitancy in Africa to the ... - Reddit,https://www.reddit.com/r/science/comments/110jrss/study_links_covid19_vaccination_hesitancy_in/,2024-11-30T16:33:14.498185,advanced
microchips in vaccines,site:reddit.com ethnic minorities view on vaccination misinformation,Scientists have found misinformation posted online about the ... - Reddit,https://www.reddit.com/r/science/comments/udawb8/scientists_have_found_misinformation_posted/,2024-11-30T16:33:14.511472,advanced
microchips in vaccines,site:reddit.com ethnic minorities view on vaccination misinformation,Vaccine misinformation : r/CoronavirusDownunder - Reddit,https://www.reddit.com/r/CoronavirusDownunder/comments/1cjbl1l/vaccine_misinformation/,2024-11-30T16:33:14.527336,advanced
microchips in vaccines,site:reddit.com ethnic minorities view on vaccination misinformation,Misinformation on social media fuels vaccine hesitancy ... - Reddit,https://www.reddit.com/r/science/comments/k6pi8n/misinformation_on_social_media_fuels_vaccine/,2024-11-30T16:33:14.540093,advanced
microchips in vaccines,site:reddit.com ethnic minorities view on vaccination misinformation,CMV: Misinformation is often better viewed as a symptom of ... - Reddit,https://www.reddit.com/r/changemyview/comments/18eckdg/cmv_misinformation_is_often_better_viewed_as_a/,2024-11-30T16:33:14.553974,advanced
microchips in vaccines,site:reddit.com ethnic minorities view on vaccination misinformation,"""MB Human Rights Commission responds to misinformation ... - Reddit",https://www.reddit.com/r/Winnipeg/comments/phr6g8/mb_human_rights_commission_responds_to/,2024-11-30T16:33:14.571389,advanced
microchips in vaccines,site:reddit.com ethnic minorities view on vaccination misinformation,"Vaccination in Hungary: scandals, misinformation, segregation",https://www.reddit.com/r/europeanunion/comments/maoefb/vaccination_in_hungary_scandals_misinformation/,2024-11-30T16:33:14.584911,advanced
microchips in vaccines,site:reddit.com ethnic minorities view on vaccination misinformation,Facebook's design makes it unable to control vaccine misinformation,https://www.reddit.com/r/neoliberal/comments/16olhx7/facebooks_design_makes_it_unable_to_control/,2024-11-30T16:33:14.599242,advanced
microchips in vaccines,site:reddit.com ethnic minorities view on vaccination misinformation,"Vaccination in Hungary: scandals, misinformation, segregation",https://www.reddit.com/r/europeanparliament/comments/mao7vb/vaccination_in_hungary_scandals_misinformation/,2024-11-30T16:33:14.611642,advanced
microchips in vaccines,site:reddit.com ethnic minorities view on vaccination misinformation,YouTube needs to add a COVID 19 or vaccination misinformation ... - Reddit,https://www.reddit.com/r/youtube/comments/pe8e82/youtube_needs_to_add_a_covid_19_or_vaccination/,2024-11-30T16:33:14.624882,advanced
microchips in vaccines,site:reddit.com ethnic minorities view on vaccination misinformation,Why are there no ethnic minorities in IT leadership positions in ...,https://www.reddit.com/r/AskAGerman/comments/y2xas9/why_are_there_no_ethnic_minorities_in_it/,2024-11-30T16:33:14.639302,advanced
microchips in vaccines,site:reddit.com ethnic minorities view on vaccination misinformation,Influenza rates hitting harder for certain demographic groups in ...,https://www.reddit.com/r/Virginia/comments/ze8b31/influenza_rates_hitting_harder_for_certain/,2024-11-30T16:33:14.653978,advanced
microchips in vaccines,site:reddit.com ethnic minorities view on vaccination misinformation,Military COVID-19 vaccine mandate repealed in defense bill ... - Reddit,https://www.reddit.com/r/army/comments/zeqmn7/military_covid19_vaccine_mandate_repealed_in/,2024-11-30T16:33:14.666058,advanced
microchips in vaccines,site:reddit.com ethnic minorities view on vaccination misinformation,r/science on Reddit: A model of how misinformation spreads on Twitter ...,https://www.reddit.com/r/science/comments/vlw2x9/a_model_of_how_misinformation_spreads_on_twitter/,2024-11-30T16:33:14.680175,advanced
