topic,query,title,url,timestamp,search_depth
vaccination myths,site:reddit.com elderly population view on vaccination trends,~65% of population completed full regimen as at 4 Aug (Wed ... - Reddit,https://www.reddit.com/r/singapore/comments/oykpeq/65_of_population_completed_full_regimen_as_at_4/,2024-11-30T17:08:10.021411,advanced
vaccination myths,site:reddit.com elderly population view on vaccination trends,No Observable Benefit of Vaccination Campaigns in the Elderly ... - Reddit,https://www.reddit.com/r/ScienceUncensored/comments/115yevs/no_observable_benefit_of_vaccination_campaigns_in/,2024-11-30T17:08:10.034620,advanced
vaccination myths,site:reddit.com elderly population view on vaccination trends,Is the job market really the worst in decades? : r/jobs - Reddit,https://www.reddit.com/r/jobs/comments/16p6jc4/is_the_job_market_really_the_worst_in_decades/,2024-11-30T17:08:10.047805,advanced
vaccination myths,site:reddit.com elderly population view on vaccination trends,New vaccine policy : r/uwo - Reddit,https://www.reddit.com/r/uwo/comments/pbinpb/new_vaccine_policy/,2024-11-30T17:08:10.061032,advanced
vaccination myths,site:reddit.com elderly population view on vaccination trends,A vaccine for aging? Scientists create vaccine that eliminates aged ...,https://www.reddit.com/r/longevity/comments/remzsb/a_vaccine_for_aging_scientists_create_vaccine/,2024-11-30T17:08:10.075880,advanced
vaccination myths,site:reddit.com elderly population view on vaccination trends,Uptake of COVID-19 vaccine boosters has stalled in the US at ... - Reddit,https://www.reddit.com/r/science/comments/16zl4rb/uptake_of_covid19_vaccine_boosters_has_stalled_in/,2024-11-30T17:08:10.088558,advanced
vaccination myths,site:reddit.com elderly population view on vaccination trends,Population ageing is a defining global trend of our times: In ... - Reddit,https://www.reddit.com/r/Futurology/comments/10anq0s/population_ageing_is_a_defining_global_trend_of/,2024-11-30T17:08:10.105228,advanced
vaccination myths,site:reddit.com elderly population view on vaccination trends,Study: Link between Vaccination Uptake & Excess Mortality,https://www.reddit.com/r/DebateVaccines/comments/11ynxt0/study_link_between_vaccination_uptake_excess/,2024-11-30T17:08:10.122131,advanced
vaccination myths,site:reddit.com elderly population view on vaccination trends,Major Israeli study: COVID death rate among elderly slashed by ... - Reddit,https://www.reddit.com/r/science/comments/vw6261/major_israeli_study_covid_death_rate_among/,2024-11-30T17:08:10.221817,advanced
vaccination myths,site:reddit.com elderly population view on vaccination trends,The role of social circle COVID-19 illness and vaccination ... - Reddit,https://www.reddit.com/r/COVID19/comments/10l9is7/the_role_of_social_circle_covid19_illness_and/,2024-11-30T17:08:10.235598,advanced
vaccination myths,site:reddit.com elderly population view on vaccination trends,Omicron is more serious in countries with an older population ... - Reddit,https://www.reddit.com/r/DebateVaccines/comments/s7d2hk/omicron_is_more_serious_in_countries_with_an/,2024-11-30T17:08:10.250477,advanced
vaccination myths,site:reddit.com elderly population view on vaccination trends,Why are old people often mean and rude? : r/AskOldPeople - Reddit,https://www.reddit.com/r/AskOldPeople/comments/xhih3n/why_are_old_people_often_mean_and_rude/,2024-11-30T17:08:10.263067,advanced
vaccination myths,site:reddit.com elderly population view on vaccination trends,"Good to see an increase in elderly vaccination rates, with ... - Reddit",https://www.reddit.com/r/CoronavirusDownunder/comments/pb8uf4/good_to_see_an_increase_in_elderly_vaccination/,2024-11-30T17:08:10.275790,advanced
vaccination myths,site:reddit.com elderly population view on vaccination trends,Why do we not devote all scientific effort towards anti-aging?,https://www.reddit.com/r/Futurology/comments/16bact3/why_do_we_not_devote_all_scientific_effort/,2024-11-30T17:08:10.290092,advanced
vaccination myths,site:reddit.com elderly population view on vaccination trends,"TIL Japan is considered a ""super-aged"" nation since more than ... - Reddit",https://www.reddit.com/r/todayilearned/comments/ygw7vw/til_japan_is_considered_a_superaged_nation_since/,2024-11-30T17:08:10.302603,advanced
vaccination myths,site:reddit.com elderly population view on vaccination trends,What happens when/if the number of elders far surpasses the ... - Reddit,https://www.reddit.com/r/Futurology/comments/17082ro/what_happens_whenif_the_number_of_elders_far/,2024-11-30T17:08:10.316643,advanced
vaccination myths,site:reddit.com elderly population view on vaccination trends,Is it normal/OK that the majority of citizens are seniors?,https://www.reddit.com/r/CitiesSkylines/comments/y4oxh5/is_it_normalok_that_the_majority_of_citizens_are/,2024-11-30T17:08:10.329997,advanced
vaccination myths,site:reddit.com elderly population view on vaccination trends,"In the future, will anti-aging technology exist before the ... - Reddit",https://www.reddit.com/r/Futurology/comments/17ogz01/in_the_future_will_antiaging_technology_exist/,2024-11-30T17:08:10.342992,advanced
vaccination myths,site:reddit.com elderly population view on vaccination trends,After vaccination: Covid-19 cases in elderly people living in ... - Reddit,https://www.reddit.com/r/Coronavirus/comments/mtkvej/after_vaccination_covid19_cases_in_elderly_people/,2024-11-30T17:08:10.356660,advanced
vaccination myths,site:reddit.com elderly population view on vaccination trends,What are people NOT dying of | Claims of excess death being ... - Reddit,https://www.reddit.com/r/WayOfTheBern/comments/zmaop6/what_are_people_not_dying_of_claims_of_excess/,2024-11-30T17:08:10.372171,advanced
