topic,query,title,url,timestamp,search_depth
microchips in vaccines,site:reddit.com socioeconomic view on vaccination misinformation,We call upon Reddit to take action against the rampant Coronavirus ...,https://www.reddit.com/r/vaxxhappened/comments/pbe8nj/we_call_upon_reddit_to_take_action_against_the/,2024-11-30T16:33:30.171459,advanced
microchips in vaccines,site:reddit.com socioeconomic view on vaccination misinformation,Misinformation Poses Threat To Rural COVID-19 Vaccination ... - Reddit,https://www.reddit.com/r/oklahoma/comments/kiw76y/misinformation_poses_threat_to_rural_covid19/,2024-11-30T16:33:30.190073,advanced
microchips in vaccines,site:reddit.com socioeconomic view on vaccination misinformation,Misinformation on social media fuels vaccine hesitancy ... - Reddit,https://www.reddit.com/r/science/comments/k6pi8n/misinformation_on_social_media_fuels_vaccine/,2024-11-30T16:33:30.207614,advanced
microchips in vaccines,site:reddit.com socioeconomic view on vaccination misinformation,Vaccine misinformation : r/CoronavirusDownunder - Reddit,https://www.reddit.com/r/CoronavirusDownunder/comments/1cjbl1l/vaccine_misinformation/,2024-11-30T16:33:30.223431,advanced
microchips in vaccines,site:reddit.com socioeconomic view on vaccination misinformation,New vaccine policy : r/uwo - Reddit,https://www.reddit.com/r/uwo/comments/pbinpb/new_vaccine_policy/,2024-11-30T16:33:30.238824,advanced
microchips in vaccines,site:reddit.com socioeconomic view on vaccination misinformation,Study links Covid-19 vaccination hesitancy in Africa to the ... - Reddit,https://www.reddit.com/r/science/comments/110jrss/study_links_covid19_vaccination_hesitancy_in/,2024-11-30T16:33:30.254670,advanced
microchips in vaccines,site:reddit.com socioeconomic view on vaccination misinformation,Misinformation : r/TrueAntiVaccination - Reddit,https://www.reddit.com/r/TrueAntiVaccination/comments/t73z61/misinformation/,2024-11-30T16:33:30.270974,advanced
microchips in vaccines,site:reddit.com socioeconomic view on vaccination misinformation,Scientists have found misinformation posted online about the ... - Reddit,https://www.reddit.com/r/science/comments/udawb8/scientists_have_found_misinformation_posted/,2024-11-30T16:33:30.287533,advanced
microchips in vaccines,site:reddit.com socioeconomic view on vaccination misinformation,COVID denialism and policy clarifications : r/redditsecurity,https://www.reddit.com/r/redditsecurity/comments/pfyqqn/covid_denialism_and_policy_clarifications/,2024-11-30T16:33:30.305616,advanced
microchips in vaccines,site:reddit.com socioeconomic view on vaccination misinformation,r/science on Reddit: A model of how misinformation spreads on Twitter ...,https://www.reddit.com/r/science/comments/vlw2x9/a_model_of_how_misinformation_spreads_on_twitter/,2024-11-30T16:33:30.326741,advanced
microchips in vaccines,site:reddit.com socioeconomic view on vaccination misinformation,Dr. John Campbell gets BBC'd in the latest More or Less podcast,https://www.reddit.com/r/DecodingTheGurus/comments/1705k3u/dr_john_campbell_gets_bbcd_in_the_latest_more_or/,2024-11-30T16:33:30.341153,advanced
microchips in vaccines,site:reddit.com socioeconomic view on vaccination misinformation,How does Reddit combat misinformation? : r/help,https://www.reddit.com/r/help/comments/ou5zq5/how_does_reddit_combat_misinformation/,2024-11-30T16:33:30.355777,advanced
microchips in vaccines,site:reddit.com socioeconomic view on vaccination misinformation,Study finds COVID-19 misinformation linked to vaccination ... - Reddit,https://www.reddit.com/r/EverythingScience/comments/ucku6a/study_finds_covid19_misinformation_linked_to/,2024-11-30T16:33:30.370985,advanced
microchips in vaccines,site:reddit.com socioeconomic view on vaccination misinformation,How you can help fight disinformation on Reddit,https://www.reddit.com/r/vaxxhappened/comments/pden1w/how_you_can_help_fight_disinformation_on_reddit/,2024-11-30T16:33:30.384444,advanced
microchips in vaccines,site:reddit.com socioeconomic view on vaccination misinformation,Surgeon General warns misinformation is the greatest threat to ... - Reddit,https://www.reddit.com/r/Coronavirus/comments/o7n1is/surgeon_general_warns_misinformation_is_the/,2024-11-30T16:33:30.400479,advanced
microchips in vaccines,site:reddit.com socioeconomic view on vaccination misinformation,Cardiac sequelae in athletes following COVID-19 vaccination ... - Reddit,https://www.reddit.com/r/Coronavirus/comments/15qxg4t/cardiac_sequelae_in_athletes_following_covid19/,2024-11-30T16:33:30.414205,advanced
microchips in vaccines,site:reddit.com socioeconomic view on vaccination misinformation,Misinformation Spread By Anti-Science Groups Endangers COVID-19 ...,https://www.reddit.com/r/Coronavirus/comments/klr3ks/misinformation_spread_by_antiscience_groups/,2024-11-30T16:33:30.428526,advanced
microchips in vaccines,site:reddit.com socioeconomic view on vaccination misinformation,CMV: The right wing's obsession with trans issues is largely ... - Reddit,https://www.reddit.com/r/changemyview/comments/16glz0r/cmv_the_right_wings_obsession_with_trans_issues/,2024-11-30T16:33:30.443674,advanced
microchips in vaccines,site:reddit.com socioeconomic view on vaccination misinformation,Measuring the impact of COVID-19 vaccine misinformation on vaccination ...,https://www.reddit.com/r/COVID19/comments/lfbfkr/measuring_the_impact_of_covid19_vaccine/,2024-11-30T16:33:30.462357,advanced
microchips in vaccines,site:reddit.com socioeconomic view on vaccination misinformation,AskScience AMA Series: We're misinformation and media ... - Reddit,https://www.reddit.com/r/askscience/comments/j1x23h/askscience_ama_series_were_misinformation_and/,2024-11-30T16:33:30.477672,advanced
