topic,query,title,url,timestamp,search_depth
vaccine safety,site:reddit.com religious view on microchips in vaccines,"Putting Microchips in Vaccines Is a Terrible Idea, When You ... - Reddit",https://www.reddit.com/r/antivax/comments/nrsqam/putting_microchips_in_vaccines_is_a_terrible_idea/,2024-11-30T17:14:43.372349,advanced
vaccine safety,site:reddit.com religious view on microchips in vaccines,"Why would goverment need to put microchips into vaccines, when ... - Reddit",https://www.reddit.com/r/conspiracytheories/comments/lhyet6/why_would_goverment_need_to_put_microchips_into/,2024-11-30T17:14:43.392573,advanced
vaccine safety,site:reddit.com religious view on microchips in vaccines,Does anyone actually think there are microchips in the vaccine ... - Reddit,https://www.reddit.com/r/conspiracy/comments/oaxpf2/does_anyone_actually_think_there_are_microchips/,2024-11-30T17:14:43.406999,advanced
vaccine safety,site:reddit.com religious view on microchips in vaccines,Vaccines and Religious Hypocrisy : r/exchristian - Reddit,https://www.reddit.com/r/exchristian/comments/sreqrg/vaccines_and_religious_hypocrisy/,2024-11-30T17:14:43.428120,advanced
vaccine safety,site:reddit.com religious view on microchips in vaccines,Religious Exemption for Vaccine Opt Out.... : r/nursing - Reddit,https://www.reddit.com/r/nursing/comments/qz3py6/religious_exemption_for_vaccine_opt_out/,2024-11-30T17:14:43.443172,advanced
vaccine safety,site:reddit.com religious view on microchips in vaccines,Can we talk about religious exemptions from the Vaccine in ... - Reddit,https://www.reddit.com/r/CoronavirusWA/comments/p750io/can_we_talk_about_religious_exemptions_from_the/,2024-11-30T17:14:43.458549,advanced
vaccine safety,site:reddit.com religious view on microchips in vaccines,Judge: Mississippi must give religious exemption on vaccines ... - Reddit,https://www.reddit.com/r/atheism/comments/12s32xo/judge_mississippi_must_give_religious_exemption/,2024-11-30T17:14:43.472269,advanced
vaccine safety,site:reddit.com religious view on microchips in vaccines,"Fr. Panayiotis on vaccines, microchips, 666 & his encounter ... - Reddit",https://www.reddit.com/r/OrthodoxChristianity/comments/kj09jv/fr_panayiotis_on_vaccines_microchips_666_his/,2024-11-30T17:14:43.486480,advanced
vaccine safety,site:reddit.com religious view on microchips in vaccines,A Swedish Firm Has Created an Under-Skin Microchip for COVID Vaccine ...,https://www.reddit.com/r/Futurology/comments/rmyg6l/a_swedish_firm_has_created_an_underskin_microchip/,2024-11-30T17:14:43.503544,advanced
vaccine safety,site:reddit.com religious view on microchips in vaccines,What is the Christian view on mandatory vaccines? : r/Christianity - Reddit,https://www.reddit.com/r/Christianity/comments/g6qd1b/what_is_the_christian_view_on_mandatory_vaccines/,2024-11-30T17:14:43.518604,advanced
vaccine safety,site:reddit.com religious view on microchips in vaccines,Bill Gates confirms he won't use a COVID-19 vaccine to microchip people,https://www.reddit.com/r/Coronavirus/comments/hwnv4q/bill_gates_confirms_he_wont_use_a_covid19_vaccine/,2024-11-30T17:14:43.535724,advanced
vaccine safety,site:reddit.com religious view on microchips in vaccines,Views on the vaccines? : r/Christian - Reddit,https://www.reddit.com/r/Christian/comments/q7flkp/views_on_the_vaccines/,2024-11-30T17:14:43.633392,advanced
vaccine safety,site:reddit.com religious view on microchips in vaccines,Covid vaccines aren't linked to sudden death in young people ... - Reddit,https://www.reddit.com/r/Coronavirus/comments/1c1lg88/covid_vaccines_arent_linked_to_sudden_death_in/,2024-11-30T17:14:43.651584,advanced
vaccine safety,site:reddit.com religious view on microchips in vaccines,Microchips are the mark of the beast? : r/Christianity - Reddit,https://www.reddit.com/r/Christianity/comments/i462yq/microchips_are_the_mark_of_the_beast/,2024-11-30T17:14:43.665725,advanced
vaccine safety,site:reddit.com religious view on microchips in vaccines,What do chip implants in a hand have to do with The Mark of ... - Reddit,https://www.reddit.com/r/Christianity/comments/ppct8n/what_do_chip_implants_in_a_hand_have_to_do_with/,2024-11-30T17:14:43.681108,advanced
vaccine safety,site:reddit.com religious view on microchips in vaccines,Who profits from religious conspiracies about microchips in vaccines ...,https://www.reddit.com/r/AskALiberal/comments/snring/who_profits_from_religious_conspiracies_about/,2024-11-30T17:14:43.700220,advanced
vaccine safety,site:reddit.com religious view on microchips in vaccines,Swedish Company Epicenter Develops Microchip Implant That Can ... - Reddit,https://www.reddit.com/r/Coronavirus/comments/rkjink/swedish_company_epicenter_develops_microchip/,2024-11-30T17:14:43.713819,advanced
vaccine safety,site:reddit.com religious view on microchips in vaccines,Religious exemption request. : r/CVS - Reddit,https://www.reddit.com/r/CVS/comments/rgdgtc/religious_exemption_request/,2024-11-30T17:14:43.733238,advanced
vaccine safety,site:reddit.com religious view on microchips in vaccines,[Serious] why do some people genuinely believe the covid vaccine has a ...,https://www.reddit.com/r/AskReddit/comments/kqj663/serious_why_do_some_people_genuinely_believe_the/,2024-11-30T17:14:43.746876,advanced
vaccine safety,site:reddit.com religious view on microchips in vaccines,Parents believing in Cospiracy theories : r/ScienceBasedParenting - Reddit,https://www.reddit.com/r/ScienceBasedParenting/comments/kvy85g/parents_believing_in_cospiracy_theories/,2024-11-30T17:14:43.761244,advanced
