topic,query,title,url,timestamp,search_depth
anti-vax,site:reddit.com public perception of vaccines,Perceptions of Vaccines and Science Survey - Reddit,https://www.reddit.com/r/askaustin/comments/zsrs1q/perceptions_of_vaccines_and_science_survey/,2024-11-30T16:22:49.805352,advanced
anti-vax,site:reddit.com public perception of vaccines,[Survey] The Impact of Social Media on COVID-19 Vaccine Perception ...,https://www.reddit.com/r/ryerson/comments/l5hl4i/survey_the_impact_of_social_media_on_covid19/,2024-11-30T16:22:49.819675,advanced
anti-vax,site:reddit.com public perception of vaccines,Is it just me or has the public opinion on nurses has gotten ... - Reddit,https://www.reddit.com/r/nursing/comments/nemrfb/is_it_just_me_or_has_the_public_opinion_on_nurses/,2024-11-30T16:22:49.834612,advanced
anti-vax,site:reddit.com public perception of vaccines,"Permanent Vertigo, dizziness, depth perception issues after covid",https://www.reddit.com/r/CovidVaccineEffects/comments/1dp5due/permanent_vertigo_dizziness_depth_perception/,2024-11-30T16:22:49.849674,advanced
anti-vax,site:reddit.com public perception of vaccines,Survey of Public Perception of COVID-19 Vaccination : r/Acadiana - Reddit,https://www.reddit.com/r/Acadiana/comments/z87do1/survey_of_public_perception_of_covid19_vaccination/,2024-11-30T16:22:49.864458,advanced
anti-vax,site:reddit.com public perception of vaccines,Best Vaccine Posts - Reddit,https://www.reddit.com/t/vaccine/,2024-11-30T16:22:49.880300,advanced
anti-vax,site:reddit.com public perception of vaccines,"How to respond to ""Why has the number of vaccines recommended for ...",https://www.reddit.com/r/Vaccine/comments/y4qlo9/how_to_respond_to_why_has_the_number_of_vaccines/,2024-11-30T16:22:49.893228,advanced
anti-vax,site:reddit.com public perception of vaccines,Novel COVID-19 vaccine could provide longer-lasting protection ... - Reddit,https://www.reddit.com/r/science/comments/13g37zk/novel_covid19_vaccine_could_provide_longerlasting/,2024-11-30T16:22:49.905732,advanced
anti-vax,site:reddit.com public perception of vaccines,What historical fact really messes with your perception of time?,https://www.reddit.com/r/AskReddit/comments/107eaxr/what_historical_fact_really_messes_with_your/,2024-11-30T16:22:49.917798,advanced
anti-vax,site:reddit.com public perception of vaccines,What do you think about Covid Vaccines? : r/CovidVaccine - Reddit,https://www.reddit.com/r/CovidVaccine/comments/puc0e2/what_do_you_think_about_covid_vaccines/,2024-11-30T16:22:49.932213,advanced
anti-vax,site:reddit.com public perception of vaccines,VACCINE PERCEPTIONS : r/MapPorn - Reddit,https://www.reddit.com/r/MapPorn/comments/peus0e/vaccine_perceptions/,2024-11-30T16:22:49.950053,advanced
anti-vax,site:reddit.com public perception of vaccines,Why are people against vaccines and vaccinations?,https://www.reddit.com/r/TooAfraidToAsk/comments/y897fg/why_are_people_against_vaccines_and_vaccinations/,2024-11-30T16:22:49.965052,advanced
anti-vax,site:reddit.com public perception of vaccines,Long term side effects from the vaccine? : r/CovidVaccinated - Reddit,https://www.reddit.com/r/CovidVaccinated/comments/o3k21p/long_term_side_effects_from_the_vaccine/,2024-11-30T16:22:50.064175,advanced
anti-vax,site:reddit.com public perception of vaccines,"Pediatricians' perceptions, practices, and barriers ... - Reddit",https://www.reddit.com/r/COVID19/comments/139ja6u/pediatricians_perceptions_practices_and_barriers/,2024-11-30T16:22:50.080609,advanced
anti-vax,site:reddit.com public perception of vaccines,"People that are skeptical of the covid vaccines, why? : r ... - Reddit",https://www.reddit.com/r/SeriousConversation/comments/na0dgf/people_that_are_skeptical_of_the_covid_vaccines/,2024-11-30T16:22:50.095757,advanced
anti-vax,site:reddit.com public perception of vaccines,[Academic] Survey on perceptions for mRNA/Covid-19 Vaccines,https://www.reddit.com/r/SurveyExchange/comments/1bi6iu6/academic_survey_on_perceptions_for_mrnacovid19/,2024-11-30T16:22:50.110847,advanced
anti-vax,site:reddit.com public perception of vaccines,Coronavirus Massachusetts - Reddit,https://www.reddit.com/r/CoronavirusMa/,2024-11-30T16:22:50.126131,advanced
anti-vax,site:reddit.com public perception of vaccines,[OC] World Perception on Vaccines : r/dataisbeautiful - Reddit,https://www.reddit.com/r/dataisbeautiful/comments/c2mmgb/oc_world_perception_on_vaccines/,2024-11-30T16:22:50.141117,advanced
anti-vax,site:reddit.com public perception of vaccines,CDC Recommends Updated 2024-2025 COVID-19 and Flu Vaccines for ... - Reddit,https://www.reddit.com/r/Coronavirus/comments/1dqc0g0/cdc_recommends_updated_20242025_covid19_and_flu/,2024-11-30T16:22:50.156626,advanced
anti-vax,site:reddit.com public perception of vaccines,Public access phone number/address for board of medicine ... - Reddit,https://www.reddit.com/r/Residency/comments/mf9o7s/public_access_phone_numberaddress_for_board_of/,2024-11-30T16:22:50.170659,advanced
