topic,query,title,url,timestamp,search_depth
vaccine safety,site:reddit.com personal knowledge and microchips in vaccines,For people still paranoid that they're 'sneaking microchips ... - Reddit,https://www.reddit.com/r/Vaccine/comments/nfyiec/for_people_still_paranoid_that_theyre_sneaking/,2024-11-30T17:14:53.323991,advanced
vaccine safety,site:reddit.com personal knowledge and microchips in vaccines,Why is there this huge conspiracy about the covid vaccine and ...,https://www.reddit.com/r/ask/comments/kiz08t/why_is_there_this_huge_conspiracy_about_the_covid/,2024-11-30T17:14:53.340068,advanced
vaccine safety,site:reddit.com personal knowledge and microchips in vaccines,Does anyone actually think there are microchips in the vaccine ... - Reddit,https://www.reddit.com/r/conspiracy/comments/oaxpf2/does_anyone_actually_think_there_are_microchips/,2024-11-30T17:14:53.353792,advanced
vaccine safety,site:reddit.com personal knowledge and microchips in vaccines,Believe you in conspiracy theories about microchips in vaccines or not ...,https://www.reddit.com/r/guideforhealth/comments/17k21dt/believe_you_in_conspiracy_theories_about/,2024-11-30T17:14:53.368680,advanced
vaccine safety,site:reddit.com personal knowledge and microchips in vaccines,I've found out that the microchip in the vaccines theory is true ...,https://www.reddit.com/r/FuckYouKaren/comments/n5pxrk/ive_found_out_that_the_microchip_in_the_vaccines/,2024-11-30T17:14:53.384145,advanced
vaccine safety,site:reddit.com personal knowledge and microchips in vaccines,Is microchipping through vaccines even physically possible?,https://www.reddit.com/r/NoStupidQuestions/comments/h7xmy1/is_microchipping_through_vaccines_even_physically/,2024-11-30T17:14:53.397199,advanced
vaccine safety,site:reddit.com personal knowledge and microchips in vaccines,Missouri House advances bill to limit nonexistent vaccine microchips ...,https://www.reddit.com/r/StLouis/comments/1203ezn/missouri_house_advances_bill_to_limit_nonexistent/,2024-11-30T17:14:53.411564,advanced
vaccine safety,site:reddit.com personal knowledge and microchips in vaccines,[Serious] why do some people genuinely believe the covid vaccine has a ...,https://www.reddit.com/r/AskReddit/comments/kqj663/serious_why_do_some_people_genuinely_believe_the/,2024-11-30T17:14:53.426359,advanced
vaccine safety,site:reddit.com personal knowledge and microchips in vaccines,People who believe that Bill Gates wants to inject microchips via ...,https://www.reddit.com/r/AskReddit/comments/ha8277/people_who_believe_that_bill_gates_wants_to/,2024-11-30T17:14:53.441178,advanced
vaccine safety,site:reddit.com personal knowledge and microchips in vaccines,Covid-19 vaccines do not contain magnetic microchips,https://www.reddit.com/r/Coronavirus/comments/nd0tst/covid19_vaccines_do_not_contain_magnetic/,2024-11-30T17:14:53.454990,advanced
vaccine safety,site:reddit.com personal knowledge and microchips in vaccines,A Swedish Firm Has Created an Under-Skin Microchip for COVID Vaccine ...,https://www.reddit.com/r/Futurology/comments/rmyg6l/a_swedish_firm_has_created_an_underskin_microchip/,2024-11-30T17:14:53.470310,advanced
vaccine safety,site:reddit.com personal knowledge and microchips in vaccines,Researchers have debunked a popular anti-vaccination theory by ... - Reddit,https://www.reddit.com/r/science/comments/ouetl6/researchers_have_debunked_a_popular/,2024-11-30T17:14:53.484277,advanced
vaccine safety,site:reddit.com personal knowledge and microchips in vaccines,"Putting Microchips in Vaccines Is a Terrible Idea, When You ... - Reddit",https://www.reddit.com/r/skeptic/comments/nrsovl/putting_microchips_in_vaccines_is_a_terrible_idea/,2024-11-30T17:14:53.497513,advanced
vaccine safety,site:reddit.com personal knowledge and microchips in vaccines,Is the concept of Personal Knowledge Management flawed? : r/PKMS - Reddit,https://www.reddit.com/r/PKMS/comments/zkrs3m/is_the_concept_of_personal_knowledge_management/,2024-11-30T17:14:53.602325,advanced
vaccine safety,site:reddit.com personal knowledge and microchips in vaccines,Microchip needle vs vaccine needle size : r/Damnthatsinteresting - Reddit,https://www.reddit.com/r/Damnthatsinteresting/comments/mh77ze/microchip_needle_vs_vaccine_needle_size/,2024-11-30T17:14:53.616051,advanced
vaccine safety,site:reddit.com personal knowledge and microchips in vaccines,They put microchips into the vaccines and hacked my voice smh ... - Reddit,https://www.reddit.com/r/traaaaaaannnnnnnnnns/comments/sioa5b/they_put_microchips_into_the_vaccines_and_hacked/,2024-11-30T17:14:53.642179,advanced
vaccine safety,site:reddit.com personal knowledge and microchips in vaccines,That's why there can't be any microchips in the vaccine,https://www.reddit.com/r/vaxxhappened/comments/klryc4/thats_why_there_cant_be_any_microchips_in_the/,2024-11-30T17:14:53.658023,advanced
vaccine safety,site:reddit.com personal knowledge and microchips in vaccines,Microchips? Nope. Here's The Full List of Ingredients in The ... - Reddit,https://www.reddit.com/r/Coronavirus/comments/ki1h1z/microchips_nope_heres_the_full_list_of/,2024-11-30T17:14:53.674828,advanced
vaccine safety,site:reddit.com personal knowledge and microchips in vaccines,"Putting Microchips in Vaccines Is a Terrible Idea, When You ... - Reddit",https://www.reddit.com/r/antivax/comments/nrsqam/putting_microchips_in_vaccines_is_a_terrible_idea/,2024-11-30T17:14:53.689892,advanced
vaccine safety,site:reddit.com personal knowledge and microchips in vaccines,"People who think there's a microchip in the vaccine, what do ... - Reddit",https://www.reddit.com/r/AskReddit/comments/ksb793/people_who_think_theres_a_microchip_in_the/,2024-11-30T17:14:53.712062,advanced
